{
  "schema_version": "1.0.0",
  "case_id": "mvp-synthetic-ecc-policy-001",
  "created_at": "2026-08-20T00:00:00Z",
  "base_packet_fixture": "tests/schema/fixtures/valid/synthetic-v2-hold.json",
  "particle_flux": {
    "value": 1000,
    "quantity_kind": "PARTICLE_FLUX",
    "unit": "particles/cm2/s",
    "metadata": {
      "data_class": "SYNTHETIC", "version": "mvp-fixture-v1", "created_at": "2026-08-20T00:00:00Z",
      "content_hash": "sha256:1515151515151515151515151515151515151515151515151515151515151515", "review_status": "READY_FOR_REVIEW",
      "calculation_run": {"run_id": "mvp-fixture-gen-001", "engine": "spectra-mvp-fixture-generator", "engine_version": "1.0.0", "input_hash": "sha256:1616161616161616161616161616161616161616161616161616161616161616", "output_hash": "sha256:1515151515151515151515151515151515151515151515151515151515151515", "executed_at": "2026-08-20T00:00:00Z"}
    }
  },
  "ecc_fault_distribution": {
    "distribution_id": "synthetic-ecc-multiplicity-v1",
    "patterns": [
      {"multiplicity_bits": 1, "incident_events": 0.05, "transition": {"corrected": 1, "detected_uncorrectable": 0, "silent_uncorrected": 0}},
      {"multiplicity_bits": 2, "incident_events": 0.01, "transition": {"corrected": 0, "detected_uncorrectable": 1, "silent_uncorrected": 0}},
      {"multiplicity_bits": 3, "incident_events": 0.003072, "transition": {"corrected": 0, "detected_uncorrectable": 0, "silent_uncorrected": 1}}
    ],
    "metadata": {
      "data_class": "SYNTHETIC", "version": "mvp-fixture-v1", "created_at": "2026-08-20T00:00:00Z",
      "content_hash": "sha256:1717171717171717171717171717171717171717171717171717171717171717", "review_status": "READY_FOR_REVIEW",
      "calculation_run": {"run_id": "mvp-fixture-gen-001", "engine": "spectra-mvp-fixture-generator", "engine_version": "1.0.0", "input_hash": "sha256:1616161616161616161616161616161616161616161616161616161616161616", "output_hash": "sha256:1717171717171717171717171717171717171717171717171717171717171717", "executed_at": "2026-08-20T00:00:00Z"}
    }
  },
  "baseline": {
    "scenario_id": "baseline-ecc-off-policy-draft",
    "ecc_enabled": false,
    "mitigation": {
      "kind": "MITIGATION", "contract_version": "2.0.0", "mitigation_id": "synthetic-ecc-disabled-v2", "component_ids": ["component-001"],
      "architecture_scope": "DEVICE", "method": "ECC", "target_failure_modes": ["SEU"], "excluded_failure_modes": ["TID", "SEL", "SEB", "SEGR"],
      "design_parameters": {"codeword_bits": 72, "data_bits": 64, "parity_bits": 8, "correctable_bits": 1, "detectable_bits": 2, "interleave_mapping_ref": "fixture://synthetic-interleave-v1", "fault_multiplicity_ref": "synthetic-ecc-multiplicity-v1", "decoder_behavior": "correct one-bit, flag two-bit", "uncorrectable_behavior": "two-bit detected; higher multiplicity may be silent"},
      "effect_model": {"model_id": "synthetic-ecc-transition-v1", "model_version": "1.0.0", "equation_id": "ECC_TRANSITION_MATRIX_V1", "validity_domain": "Synthetic fixture multiplicity counts only", "input_pointers": ["/inputs/3/cross_section", "/inputs/5/design_parameters"]},
      "verification_evidence_ids": ["synthetic-ecc-design-fixture"], "applicability": {"status": "NOT_APPLICABLE", "conditions": ["Baseline explicitly disables ECC application"]},
      "metadata": {"data_class": "SYNTHETIC", "version": "2.0.0", "created_at": "2026-08-20T00:00:00Z", "content_hash": "sha256:1818181818181818181818181818181818181818181818181818181818181818", "review_status": "READY_FOR_REVIEW", "calculation_run": {"run_id": "mvp-fixture-gen-001", "engine": "spectra-mvp-fixture-generator", "engine_version": "1.0.0", "input_hash": "sha256:1616161616161616161616161616161616161616161616161616161616161616", "output_hash": "sha256:1818181818181818181818181818181818181818181818181818181818181818", "executed_at": "2026-08-20T00:00:00Z"}}
    },
    "policy": {
      "kind": "USER_POLICY", "contract_version": "2.0.0", "policy_id": "synthetic-policy-draft-v2", "policy_version": "2.0.0-draft", "policy_content_hash": "sha256:1919191919191919191919191919191919191919191919191919191919191919",
      "scope": {"tenant_id": "synthetic-tenant", "mission_ids": ["mission-001"], "component_ids": ["component-001"], "scope_hash": "sha256:2020202020202020202020202020202020202020202020202020202020202020"},
      "rules": {"tid_design_factor": 2, "maximum_residual_seu": {"value": 0.02, "quantity_kind": "RATE", "unit": "events/mission", "metadata": {"data_class": "SYNTHETIC", "version": "2.0.0", "created_at": "2026-08-20T00:00:00Z", "content_hash": "sha256:2121212121212121212121212121212121212121212121212121212121212121", "review_status": "READY_FOR_REVIEW", "calculation_run": {"run_id": "mvp-fixture-gen-001", "engine": "spectra-mvp-fixture-generator", "engine_version": "1.0.0", "input_hash": "sha256:1616161616161616161616161616161616161616161616161616161616161616", "output_hash": "sha256:2121212121212121212121212121212121212121212121212121212121212121", "executed_at": "2026-08-20T00:00:00Z"}}}, "required_destructive_modes": ["SEL"]},
      "approval": {"status": "DRAFT", "approval_target_hash": "sha256:1919191919191919191919191919191919191919191919191919191919191919", "approval_scope_hash": "sha256:2020202020202020202020202020202020202020202020202020202020202020", "valid_from": "2026-08-20T00:00:00Z"},
      "immutable_history_ref": {"anchor_id": "synthetic-policy-draft-history", "head_hash": "sha256:2222222222222222222222222222222222222222222222222222222222222222", "store_ref": "fixture://synthetic-policy-draft-history"},
      "metadata": {"data_class": "SYNTHETIC", "version": "2.0.0", "created_at": "2026-08-20T00:00:00Z", "content_hash": "sha256:1919191919191919191919191919191919191919191919191919191919191919", "review_status": "READY_FOR_REVIEW", "calculation_run": {"run_id": "mvp-fixture-gen-001", "engine": "spectra-mvp-fixture-generator", "engine_version": "1.0.0", "input_hash": "sha256:1616161616161616161616161616161616161616161616161616161616161616", "output_hash": "sha256:1919191919191919191919191919191919191919191919191919191919191919", "executed_at": "2026-08-20T00:00:00Z"}}
    }
  },
  "variant": {
    "scenario_id": "variant-ecc-on-policy-approved",
    "ecc_enabled": true,
    "mitigation": {
      "kind": "MITIGATION", "contract_version": "2.0.0", "mitigation_id": "synthetic-ecc-enabled-v2", "component_ids": ["component-001"],
      "architecture_scope": "DEVICE", "method": "ECC", "target_failure_modes": ["SEU"], "excluded_failure_modes": ["TID", "SEL", "SEB", "SEGR"],
      "design_parameters": {"codeword_bits": 72, "data_bits": 64, "parity_bits": 8, "correctable_bits": 1, "detectable_bits": 2, "interleave_mapping_ref": "fixture://synthetic-interleave-v1", "fault_multiplicity_ref": "synthetic-ecc-multiplicity-v1", "decoder_behavior": "correct one-bit, flag two-bit", "uncorrectable_behavior": "two-bit detected; higher multiplicity may be silent"},
      "effect_model": {"model_id": "synthetic-ecc-transition-v1", "model_version": "1.0.0", "equation_id": "ECC_TRANSITION_MATRIX_V1", "validity_domain": "Synthetic fixture multiplicity counts only", "input_pointers": ["/inputs/3/cross_section", "/inputs/5/design_parameters"]},
      "verification_evidence_ids": ["synthetic-ecc-design-fixture"], "applicability": {"status": "APPLICABLE", "conditions": ["Synthetic transition fixture is complete for engineering comparison only"]},
      "metadata": {"data_class": "SYNTHETIC", "version": "2.0.0", "created_at": "2026-08-20T00:00:00Z", "content_hash": "sha256:2323232323232323232323232323232323232323232323232323232323232323", "review_status": "READY_FOR_REVIEW", "calculation_run": {"run_id": "mvp-fixture-gen-001", "engine": "spectra-mvp-fixture-generator", "engine_version": "1.0.0", "input_hash": "sha256:1616161616161616161616161616161616161616161616161616161616161616", "output_hash": "sha256:2323232323232323232323232323232323232323232323232323232323232323", "executed_at": "2026-08-20T00:00:00Z"}}
    },
    "policy": {
      "kind": "USER_POLICY", "contract_version": "2.0.0", "policy_id": "synthetic-policy-approved-v2", "policy_version": "2.0.0", "policy_content_hash": "sha256:2424242424242424242424242424242424242424242424242424242424242424",
      "scope": {"tenant_id": "synthetic-tenant", "mission_ids": ["mission-001"], "component_ids": ["component-001"], "scope_hash": "sha256:2525252525252525252525252525252525252525252525252525252525252525"},
      "rules": {"tid_design_factor": 2, "maximum_residual_seu": {"value": 0.02, "quantity_kind": "RATE", "unit": "events/mission", "metadata": {"data_class": "SYNTHETIC", "version": "2.0.0", "created_at": "2026-08-20T00:00:00Z", "content_hash": "sha256:2626262626262626262626262626262626262626262626262626262626262626", "review_status": "READY_FOR_REVIEW", "calculation_run": {"run_id": "mvp-fixture-gen-001", "engine": "spectra-mvp-fixture-generator", "engine_version": "1.0.0", "input_hash": "sha256:1616161616161616161616161616161616161616161616161616161616161616", "output_hash": "sha256:2626262626262626262626262626262626262626262626262626262626262626", "executed_at": "2026-08-20T00:00:00Z"}}}, "required_destructive_modes": ["SEL"]},
      "approval": {"status": "APPROVED", "approval_target_hash": "sha256:2424242424242424242424242424242424242424242424242424242424242424", "approval_scope_hash": "sha256:2525252525252525252525252525252525252525252525252525252525252525", "approved_by": "synthetic-approver", "approved_at": "2026-08-20T00:00:00Z", "valid_from": "2026-08-20T00:00:00Z", "valid_until": "2027-08-20T00:00:00Z"},
      "immutable_history_ref": {"anchor_id": "synthetic-policy-approved-history", "head_hash": "sha256:2727272727272727272727272727272727272727272727272727272727272727", "store_ref": "fixture://synthetic-policy-approved-history"},